{
  "clients": [
    {
      "id": "ada-pinciu",
      "name": "Ada Pinciu",
      "sessions": {
        "paid": [
          {
            "date": "2024-06-05",
            "formatted": "05.06.2024"
          },
          {
            "date": "2024-06-19",
            "formatted": "19.06.2024"
          },
          {
            "date": "2024-06-21",
            "formatted": "21.06.2024"
          },
          {
            "date": "2024-06-28",
            "formatted": "28.06.2024"
          },
          {
            "date": "2024-07-01",
            "formatted": "01.07.2024"
          },
          {
            "date": "2024-07-08",
            "formatted": "08.07.2024"
          },
          {
            "date": "2024-07-11",
            "formatted": "11.07.2024"
          },
          {
            "date": "2024-07-15",
            "formatted": "15.07.2024"
          },
          {
            "date": "2024-07-17",
            "formatted": "17.07.2024"
          },
          {
            "date": "2024-07-19",
            "formatted": "19.07.2024"
          },
          {
            "date": "2024-07-22",
            "formatted": "22.07.2024"
          },
          {
            "date": "2024-07-24",
            "formatted": "24.07.2024"
          },
          {
            "date": "2024-07-25",
            "formatted": "25.07.2024"
          },
          {
            "date": "2024-07-31",
            "formatted": "31.07.2024"
          },
          {
            "date": "2024-08-05",
            "formatted": "05.08.2024"
          },
          {
            "date": "2024-08-09",
            "formatted": "09.08.2024"
          },
          {
            "date": "2024-08-19",
            "formatted": "19.08.2024"
          },
          {
            "date": "2024-08-21",
            "formatted": "21.08.2024"
          },
          {
            "date": "2024-08-23",
            "formatted": "23.08.2024"
          },
          {
            "date": "2024-09-16",
            "formatted": "16.09.2024"
          },
          {
            "date": "2024-09-23",
            "formatted": "23.09.2024"
          },
          {
            "date": "2024-10-02",
            "formatted": "02.10.2024"
          },
          {
            "date": "2024-10-07",
            "formatted": "07.10.2024"
          },
          {
            "date": "2024-10-09",
            "formatted": "09.10.2024"
          },
          {
            "date": "2024-10-10",
            "formatted": "10.10.2024"
          },
          {
            "date": "2024-10-21",
            "formatted": "21.10.2024"
          },
          {
            "date": "2024-10-25",
            "formatted": "25.10.2024"
          },
          {
            "date": "2024-10-28",
            "formatted": "28.10.2024"
          },
          {
            "date": "2024-10-30",
            "formatted": "30.10.2024"
          },
          {
            "date": "2024-11-01",
            "formatted": "01.11.2024"
          },
          {
            "date": "2024-11-04",
            "formatted": "04.11.2024"
          },
          {
            "date": "2024-11-11",
            "formatted": "11.11.2024"
          },
          {
            "date": "2024-11-15",
            "formatted": "15.11.2024"
          },
          {
            "date": "2024-11-22",
            "formatted": "22.11.2024"
          },
          {
            "date": "2024-11-25",
            "formatted": "25.11.2024"
          },
          {
            "date": "2024-11-27",
            "formatted": "27.11.2024"
          },
          {
            "date": "2024-11-29",
            "formatted": "29.11.2024"
          },
          {
            "date": "2024-12-11",
            "formatted": "11.12.2024"
          },
          {
            "date": "2025-01-06",
            "formatted": "06.01.2025"
          },
          {
            "date": "2025-01-17",
            "formatted": "17.01.2025"
          },
          {
            "date": "2025-01-27",
            "formatted": "27.01.2025"
          },
          {
            "date": "2025-01-30",
            "formatted": "30.01.2025"
          },
          {
            "date": "2025-01-31",
            "formatted": "31.01.2025"
          },
          {
            "date": "2025-02-03",
            "formatted": "03.02.2025"
          },
          {
            "date": "2025-02-05",
            "formatted": "05.02.2025"
          },
          {
            "date": "2025-02-21",
            "formatted": "21.02.2025"
          },
          {
            "date": "2025-03-17",
            "formatted": "17.03.2025"
          },
          {
            "date": "2025-03-24",
            "formatted": "24.03.2025"
          },
          {
            "date": "2025-04-02",
            "formatted": "02.04.2025"
          },
          {
            "date": "2025-04-07",
            "formatted": "07.04.2025"
          },
          {
            "date": "2025-04-09",
            "formatted": "09.04.2025"
          },
          {
            "date": "2025-04-25",
            "formatted": "25.04.2025"
          },
          {
            "date": "2025-05-14",
            "formatted": "14.05.2025"
          },
          {
            "date": "2025-05-16",
            "formatted": "16.05.2025"
          },
          {
            "date": "2025-05-21",
            "formatted": "21.05.2025"
          },
          {
            "date": "2025-05-28",
            "formatted": "28.05.2025"
          },
          {
            "date": "2025-06-02",
            "formatted": "02.06.2025"
          },
          {
            "date": "2025-06-04",
            "formatted": "04.06.2025"
          },
          {
            "date": "2025-06-11",
            "formatted": "11.06.2025"
          }
        ],
        "unpaid": []
      },
      "stats": {
        "previousCompleted": 0,
        "currentPaidUsed": 59,
        "currentRemaining": 1,
        "currentUnpaid": 0,
        "totalCurrent": 60,
        "totalAllTime": 60
      },
      "lastUpdated": "2025-06-20"
    },
    {
      "id": "adina-gandila",
      "name": "Adina Gandila",
      "sessions": {
        "paid": [],
        "unpaid": []
      },
      "stats": {
        "previousCompleted": 0,
        "currentPaidUsed": 0,
        "currentRemaining": 0,
        "currentUnpaid": 0,
        "totalCurrent": 0,
        "totalAllTime": 0
      },
      "lastUpdated": "2025-06-20"
    },
    {
      "id": "adriana-bazarea",
      "name": "Adriana Bazarea",
      "sessions": {
        "paid": [
          {
            "date": "2024-06-10",
            "formatted": "10.06.2024"
          },
          {
            "date": "2024-06-12",
            "formatted": "12.06.2024"
          },
          {
            "date": "2024-06-17",
            "formatted": "17.06.2024"
          },
          {
            "date": "2024-06-19",
            "formatted": "19.06.2024"
          },
          {
            "date": "2024-06-26",
            "formatted": "26.06.2024"
          },
          {
            "date": "2024-07-08",
            "formatted": "08.07.2024"
          },
          {
            "date": "2024-07-10",
            "formatted": "10.07.2024"
          },
          {
            "date": "2024-07-31",
            "formatted": "31.07.2024"
          },
          {
            "date": "2024-07-31",
            "formatted": "31.07.2024"
          },
          {
            "date": "2024-08-21",
            "formatted": "21.08.2024"
          },
          {
            "date": "2024-08-21",
            "formatted": "21.08.2024"
          },
          {
            "date": "2024-09-04",
            "formatted": "04.09.2024"
          },
          {
            "date": "2024-09-18",
            "formatted": "18.09.2024"
          },
          {
            "date": "2024-09-25",
            "formatted": "25.09.2024"
          },
          {
            "date": "2024-09-27",
            "formatted": "27.09.2024"
          },
          {
            "date": "2024-10-28",
            "formatted": "28.10.2024"
          },
          {
            "date": "2024-10-30",
            "formatted": "30.10.2024"
          },
          {
            "date": "2025-05-01",
            "formatted": "01.05.2025"
          },
          {
            "date": "2025-05-05",
            "formatted": "05.05.2025"
          },
          {
            "date": "2025-06-02",
            "formatted": "02.06.2025"
          },
          {
            "date": "2025-06-04",
            "formatted": "04.06.2025"
          },
          {
            "date": "2025-06-06",
            "formatted": "06.06.2025"
          },
          {
            "date": "2025-06-13",
            "formatted": "13.06.2025"
          }
        ],
        "unpaid": []
      },
      "stats": {
        "previousCompleted": 230,
        "currentPaidUsed": 23,
        "currentRemaining": 0,
        "currentUnpaid": 0,
        "totalCurrent": 23,
        "totalAllTime": 253
      },
      "lastUpdated": "2025-06-20"
    },
    {
      "id": "adriana-ciufudean",
      "name": "Adriana Ciufudean",
      "sessions": {
        "paid": [
          {
            "date": "2024-04-01",
            "formatted": "01.04.2024"
          },
          {
            "date": "2024-04-03",
            "formatted": "03.04.2024"
          },
          {
            "date": "2024-07-01",
            "formatted": "01.07.2024"
          },
          {
            "date": "2024-07-03",
            "formatted": "03.07.2024"
          },
          {
            "date": "2024-07-10",
            "formatted": "10.07.2024"
          },
          {
            "date": "2024-07-29",
            "formatted": "29.07.2024"
          },
          {
            "date": "2024-08-05",
            "formatted": "05.08.2024"
          },
          {
            "date": "2024-08-07",
            "formatted": "07.08.2024"
          },
          {
            "date": "2024-08-21",
            "formatted": "21.08.2024"
          },
          {
            "date": "2024-09-23",
            "formatted": "23.09.2024"
          },
          {
            "date": "2024-10-02",
            "formatted": "02.10.2024"
          },
          {
            "date": "2024-10-14",
            "formatted": "14.10.2024"
          }
        ],
        "unpaid": []
      },
      "stats": {
        "previousCompleted": 0,
        "currentPaidUsed": 12,
        "currentRemaining": 0,
        "currentUnpaid": 0,
        "totalCurrent": 12,
        "totalAllTime": 12
      },
      "lastUpdated": "2025-06-20"
    },
    {
      "id": "alexander-khrystenko",
      "name": "Alexander Khrystenko",
      "sessions": {
        "paid": [
          {
            "date": "2024-06-12",
            "formatted": "12.06.2024"
          },
          {
            "date": "2024-06-17",
            "formatted": "17.06.2024"
          },
          {
            "date": "2024-06-19",
            "formatted": "19.06.2024"
          },
          {
            "date": "2024-06-21",
            "formatted": "21.06.2024"
          },
          {
            "date": "2024-06-26",
            "formatted": "26.06.2024"
          },
          {
            "date": "2024-06-28",
            "formatted": "28.06.2024"
          },
          {
            "date": "2024-07-02",
            "formatted": "02.07.2024"
          },
          {
            "date": "2024-07-05",
            "formatted": "05.07.2024"
          },
          {
            "date": "2024-07-08",
            "formatted": "08.07.2024"
          },
          {
            "date": "2024-07-11",
            "formatted": "11.07.2024"
          },
          {
            "date": "2024-07-15",
            "formatted": "15.07.2024"
          },
          {
            "date": "2024-07-22",
            "formatted": "22.07.2024"
          },
          {
            "date": "2024-07-26",
            "formatted": "26.07.2024"
          },
          {
            "date": "2024-07-29",
            "formatted": "29.07.2024"
          },
          {
            "date": "2024-07-31",
            "formatted": "31.07.2024"
          },
          {
            "date": "2024-08-07",
            "formatted": "07.08.2024"
          },
          {
            "date": "2024-08-19",
            "formatted": "19.08.2024"
          },
          {
            "date": "2024-08-21",
            "formatted": "21.08.2024"
          },
          {
            "date": "2025-01-20",
            "formatted": "20.01.2025"
          },
          {
            "date": "2025-01-20",
            "formatted": "20.01.2025"
          },
          {
            "date": "2025-01-22",
            "formatted": "22.01.2025"
          },
          {
            "date": "2025-01-27",
            "formatted": "27.01.2025"
          },
          {
            "date": "2025-01-29",
            "formatted": "29.01.2025"
          }
        ],
        "unpaid": []
      },
      "stats": {
        "previousCompleted": 0,
        "currentPaidUsed": 23,
        "currentRemaining": 8,
        "currentUnpaid": 0,
        "totalCurrent": 31,
        "totalAllTime": 31
      },
      "lastUpdated": "2025-06-20"
    },
    {
      "id": "alexandra-boboc",
      "name": "Alexandra Boboc",
      "sessions": {
        "paid": [
          {
            "date": "2024-06-10",
            "formatted": "10.06.2024"
          },
          {
            "date": "2024-06-14",
            "formatted": "14.06.2024"
          },
          {
            "date": "2024-06-17",
            "formatted": "17.06.2024"
          },
          {
            "date": "2024-07-26",
            "formatted": "26.07.2024"
          },
          {
            "date": "2024-08-02",
            "formatted": "02.08.2024"
          },
          {
            "date": "2024-08-05",
            "formatted": "05.08.2024"
          },
          {
            "date": "2024-08-09",
            "formatted": "09.08.2024"
          },
          {
            "date": "2024-08-12",
            "formatted": "12.08.2024"
          },
          {
            "date": "2024-08-19",
            "formatted": "19.08.2024"
          },
          {
            "date": "2024-08-23",
            "formatted": "23.08.2024"
          },
          {
            "date": "2024-09-13",
            "formatted": "13.09.2024"
          },
          {
            "date": "2024-10-02",
            "formatted": "02.10.2024"
          },
          {
            "date": "2024-10-07",
            "formatted": "07.10.2024"
          },
          {
            "date": "2024-10-21",
            "formatted": "21.10.2024"
          },
          {
            "date": "2024-10-25",
            "formatted": "25.10.2024"
          },
          {
            "date": "2024-11-04",
            "formatted": "04.11.2024"
          },
          {
            "date": "2024-11-08",
            "formatted": "08.11.2024"
          },
          {
            "date": "2024-11-18",
            "formatted": "18.11.2024"
          },
          {
            "date": "2024-11-25",
            "formatted": "25.11.2024"
          },
          {
            "date": "2024-12-02",
            "formatted": "02.12.2024"
          },
          {
            "date": "2025-01-13",
            "formatted": "13.01.2025"
          },
          {
            "date": "2025-01-17",
            "formatted": "17.01.2025"
          },
          {
            "date": "2025-01-20",
            "formatted": "20.01.2025"
          }
        ],
        "unpaid": [
          {
            "date": "2024-03-21",
            "formatted": "21.03.2024"
          }
        ]
      },
      "stats": {
        "previousCompleted": 0,
        "currentPaidUsed": 23,
        "currentRemaining": 0,
        "currentUnpaid": 1,
        "totalCurrent": 24,
        "totalAllTime": 24
      },
      "lastUpdated": "2025-06-20"
    },
    {
      "id": "alexandra-bumbas",
      "name": "Alexandra Bumbas",
      "sessions": {
        "paid": [
          {
            "date": "2024-06-12",
            "formatted": "12.06.2024"
          },
          {
            "date": "2024-06-26",
            "formatted": "26.06.2024"
          },
          {
            "date": "2024-06-28",
            "formatted": "28.06.2024"
          },
          {
            "date": "2024-07-01",
            "formatted": "01.07.2024"
          },
          {
            "date": "2024-07-05",
            "formatted": "05.07.2024"
          },
          {
            "date": "2024-07-08",
            "formatted": "08.07.2024"
          },
          {
            "date": "2024-07-15",
            "formatted": "15.07.2024"
          },
          {
            "date": "2024-09-17",
            "formatted": "17.09.2024"
          },
          {
            "date": "2025-07-22",
            "formatted": "22.07.2025"
          },
          {
            "date": "2025-08-02",
            "formatted": "02.08.2025"
          },
          {
            "date": "2025-08-05",
            "formatted": "05.08.2025"
          },
          {
            "date": "2025-08-07",
            "formatted": "07.08.2025"
          },
          {
            "date": "2025-08-12",
            "formatted": "12.08.2025"
          },
          {
            "date": "2025-08-21",
            "formatted": "21.08.2025"
          },
          {
            "date": "2025-09-04",
            "formatted": "04.09.2025"
          },
          {
            "date": "2025-09-06",
            "formatted": "06.09.2025"
          },
          {
            "date": "2025-09-09",
            "formatted": "09.09.2025"
          },
          {
            "date": "2025-09-11",
            "formatted": "11.09.2025"
          },
          {
            "date": "2025-09-25",
            "formatted": "25.09.2025"
          },
          {
            "date": "2025-09-27",
            "formatted": "27.09.2025"
          },
          {
            "date": "2025-09-30",
            "formatted": "30.09.2025"
          },
          {
            "date": "2025-10-04",
            "formatted": "04.10.2025"
          },
          {
            "date": "2025-10-07",
            "formatted": "07.10.2025"
          },
          {
            "date": "2025-10-14",
            "formatted": "14.10.2025"
          },
          {
            "date": "2025-10-16",
            "formatted": "16.10.2025"
          },
          {
            "date": "2025-10-21",
            "formatted": "21.10.2025"
          },
          {
            "date": "2025-10-25",
            "formatted": "25.10.2025"
          },
          {
            "date": "2025-10-30",
            "formatted": "30.10.2025"
          },
          {
            "date": "2025-11-11",
            "formatted": "11.11.2025"
          },
          {
            "date": "2025-11-18",
            "formatted": "18.11.2025"
          },
          {
            "date": "2025-11-20",
            "formatted": "20.11.2025"
          },
          {
            "date": "2025-11-22",
            "formatted": "22.11.2025"
          },
          {
            "date": "2025-11-27",
            "formatted": "27.11.2025"
          },
          {
            "date": "2025-12-02",
            "formatted": "02.12.2025"
          },
          {
            "date": "2025-12-04",
            "formatted": "04.12.2025"
          },
          {
            "date": "2025-12-06",
            "formatted": "06.12.2025"
          },
          {
            "date": "2025-12-09",
            "formatted": "09.12.2025"
          },
          {
            "date": "2025-12-11",
            "formatted": "11.12.2025"
          },
          {
            "date": "2025-12-13",
            "formatted": "13.12.2025"
          },
          {
            "date": "2025-12-16",
            "formatted": "16.12.2025"
          },
          {
            "date": "2026-01-06",
            "formatted": "06.01.2026"
          },
          {
            "date": "2026-01-08",
            "formatted": "08.01.2026"
          },
          {
            "date": "2026-01-10",
            "formatted": "10.01.2026"
          },
          {
            "date": "2026-01-13",
            "formatted": "13.01.2026"
          },
          {
            "date": "2026-01-15",
            "formatted": "15.01.2026"
          },
          {
            "date": "2026-01-17",
            "formatted": "17.01.2026"
          },
          {
            "date": "2026-01-20",
            "formatted": "20.01.2026"
          },
          {
            "date": "2026-01-22",
            "formatted": "22.01.2026"
          },
          {
            "date": "2026-01-27",
            "formatted": "27.01.2026"
          },
          {
            "date": "2026-01-27",
            "formatted": "27.01.2026"
          },
          {
            "date": "2026-01-29",
            "formatted": "29.01.2026"
          },
          {
            "date": "2026-02-03",
            "formatted": "03.02.2026"
          },
          {
            "date": "2026-02-05",
            "formatted": "05.02.2026"
          },
          {
            "date": "2026-02-11",
            "formatted": "11.02.2026"
          },
          {
            "date": "2027-02-10",
            "formatted": "10.02.2027"
          },
          {
            "date": "2027-02-12",
            "formatted": "12.02.2027"
          },
          {
            "date": "2027-02-14",
            "formatted": "14.02.2027"
          },
          {
            "date": "2027-02-17",
            "formatted": "17.02.2027"
          },
          {
            "date": "2027-03-03",
            "formatted": "03.03.2027"
          },
          {
            "date": "2027-03-05",
            "formatted": "05.03.2027"
          },
          {
            "date": "2027-03-07",
            "formatted": "07.03.2027"
          },
          {
            "date": "2027-03-10",
            "formatted": "10.03.2027"
          },
          {
            "date": "2027-03-12",
            "formatted": "12.03.2027"
          },
          {
            "date": "2027-03-14",
            "formatted": "14.03.2027"
          },
          {
            "date": "2027-03-17",
            "formatted": "17.03.2027"
          },
          {
            "date": "2027-03-24",
            "formatted": "24.03.2027"
          },
          {
            "date": "2027-03-26",
            "formatted": "26.03.2027"
          },
          {
            "date": "2027-03-28",
            "formatted": "28.03.2027"
          },
          {
            "date": "2027-03-31",
            "formatted": "31.03.2027"
          },
          {
            "date": "2027-04-02",
            "formatted": "02.04.2027"
          },
          {
            "date": "2027-04-04",
            "formatted": "04.04.2027"
          },
          {
            "date": "2027-04-07",
            "formatted": "07.04.2027"
          },
          {
            "date": "2027-04-09",
            "formatted": "09.04.2027"
          },
          {
            "date": "2027-04-18",
            "formatted": "18.04.2027"
          },
          {
            "date": "2027-04-28",
            "formatted": "28.04.2027"
          },
          {
            "date": "2027-04-30",
            "formatted": "30.04.2027"
          },
          {
            "date": "2027-05-05",
            "formatted": "05.05.2027"
          },
          {
            "date": "2027-05-07",
            "formatted": "07.05.2027"
          },
          {
            "date": "2027-05-09",
            "formatted": "09.05.2027"
          },
          {
            "date": "2027-05-12",
            "formatted": "12.05.2027"
          },
          {
            "date": "2027-05-19",
            "formatted": "19.05.2027"
          },
          {
            "date": "2027-05-26",
            "formatted": "26.05.2027"
          },
          {
            "date": "2027-05-28",
            "formatted": "28.05.2027"
          },
          {
            "date": "2027-06-02",
            "formatted": "02.06.2027"
          },
          {
            "date": "2027-06-04",
            "formatted": "04.06.2027"
          },
          {
            "date": "2027-06-11",
            "formatted": "11.06.2027"
          },
          {
            "date": "2027-06-16",
            "formatted": "16.06.2027"
          }
        ],
        "unpaid": []
      },
      "stats": {
        "previousCompleted": 200,
        "currentPaidUsed": 87,
        "currentRemaining": 2,
        "currentUnpaid": 0,
        "totalCurrent": 89,
        "totalAllTime": 289
      },
      "lastUpdated": "2025-06-20"
    },
    {
      "id": "alina-cristea",
      "name": "Alina Cristea",
      "sessions": {
        "paid": [
          {
            "date": "2024-06-10",
            "formatted": "10.06.2024"
          },
          {
            "date": "2024-06-21",
            "formatted": "21.06.2024"
          },
          {
            "date": "2024-06-28",
            "formatted": "28.06.2024"
          },
          {
            "date": "2024-07-01",
            "formatted": "01.07.2024"
          },
          {
            "date": "2024-07-05",
            "formatted": "05.07.2024"
          },
          {
            "date": "2024-07-08",
            "formatted": "08.07.2024"
          },
          {
            "date": "2024-07-22",
            "formatted": "22.07.2024"
          },
          {
            "date": "2024-07-24",
            "formatted": "24.07.2024"
          },
          {
            "date": "2024-07-25",
            "formatted": "25.07.2024"
          },
          {
            "date": "2024-07-29",
            "formatted": "29.07.2024"
          },
          {
            "date": "2024-08-05",
            "formatted": "05.08.2024"
          },
          {
            "date": "2024-08-09",
            "formatted": "09.08.2024"
          },
          {
            "date": "2024-08-12",
            "formatted": "12.08.2024"
          },
          {
            "date": "2024-08-14",
            "formatted": "14.08.2024"
          },
          {
            "date": "2024-08-19",
            "formatted": "19.08.2024"
          },
          {
            "date": "2024-10-07",
            "formatted": "07.10.2024"
          },
          {
            "date": "2024-10-10",
            "formatted": "10.10.2024"
          },
          {
            "date": "2024-10-14",
            "formatted": "14.10.2024"
          },
          {
            "date": "2024-10-16",
            "formatted": "16.10.2024"
          },
          {
            "date": "2024-10-25",
            "formatted": "25.10.2024"
          },
          {
            "date": "2024-10-28",
            "formatted": "28.10.2024"
          },
          {
            "date": "2024-11-04",
            "formatted": "04.11.2024"
          },
          {
            "date": "2025-11-01",
            "formatted": "01.11.2025"
          },
          {
            "date": "2025-11-07",
            "formatted": "07.11.2025"
          }
        ],
        "unpaid": []
      },
      "stats": {
        "previousCompleted": 0,
        "currentPaidUsed": 24,
        "currentRemaining": 0,
        "currentUnpaid": 0,
        "totalCurrent": 24,
        "totalAllTime": 24
      },
      "lastUpdated": "2025-06-20"
    },
    {
      "id": "ana-maria-enescu",
      "name": "Ana-Maria Enescu",
      "sessions": {
        "paid": [
          {
            "date": "2024-09-19",
            "formatted": "19.09.2024"
          },
          {
            "date": "2024-09-26",
            "formatted": "26.09.2024"
          }
        ],
        "unpaid": []
      },
      "stats": {
        "previousCompleted": 0,
        "currentPaidUsed": 2,
        "currentRemaining": 8,
        "currentUnpaid": 0,
        "totalCurrent": 10,
        "totalAllTime": 10
      },
      "lastUpdated": "2025-06-20"
    },
    {
      "id": "anca-ciurduc",
      "name": "Anca Ciurduc",
      "sessions": {
        "paid": [
          {
            "date": "2024-01-06",
            "formatted": "06.01.2024"
          }
        ],
        "unpaid": []
      },
      "stats": {
        "previousCompleted": 120,
        "currentPaidUsed": 1,
        "currentRemaining": 0,
        "currentUnpaid": 0,
        "totalCurrent": 1,
        "totalAllTime": 121
      },
      "lastUpdated": "2025-06-20"
    },
    {
      "id": "anca-nica",
      "name": "Anca Nica",
      "sessions": {
        "paid": [
          {
            "date": "2024-06-06",
            "formatted": "06.06.2024"
          },
          {
            "date": "2024-07-04",
            "formatted": "04.07.2024"
          },
          {
            "date": "2024-07-10",
            "formatted": "10.07.2024"
          },
          {
            "date": "2024-07-15",
            "formatted": "15.07.2024"
          },
          {
            "date": "2024-07-22",
            "formatted": "22.07.2024"
          },
          {
            "date": "2024-08-01",
            "formatted": "01.08.2024"
          },
          {
            "date": "2024-08-05",
            "formatted": "05.08.2024"
          },
          {
            "date": "2024-09-27",
            "formatted": "27.09.2024"
          },
          {
            "date": "2024-09-30",
            "formatted": "30.09.2024"
          },
          {
            "date": "2024-10-02",
            "formatted": "02.10.2024"
          },
          {
            "date": "2025-07-01",
            "formatted": "01.07.2025"
          }
        ],
        "unpaid": []
      },
      "stats": {
        "previousCompleted": 0,
        "currentPaidUsed": 11,
        "currentRemaining": 1,
        "currentUnpaid": 0,
        "totalCurrent": 12,
        "totalAllTime": 12
      },
      "lastUpdated": "2025-06-20"
    },
    {
      "id": "anca-verza",
      "name": "Anca Verza",
      "sessions": {
        "paid": [
          {
            "date": "2024-06-07",
            "formatted": "07.06.2024"
          },
          {
            "date": "2024-07-03",
            "formatted": "03.07.2024"
          },
          {
            "date": "2024-07-05",
            "formatted": "05.07.2024"
          },
          {
            "date": "2024-07-10",
            "formatted": "10.07.2024"
          },
          {
            "date": "2024-07-11",
            "formatted": "11.07.2024"
          },
          {
            "date": "2024-07-22",
            "formatted": "22.07.2024"
          },
          {
            "date": "2024-07-25",
            "formatted": "25.07.2024"
          },
          {
            "date": "2024-07-29",
            "formatted": "29.07.2024"
          },
          {
            "date": "2024-07-31",
            "formatted": "31.07.2024"
          },
          {
            "date": "2024-08-05",
            "formatted": "05.08.2024"
          },
          {
            "date": "2024-08-23",
            "formatted": "23.08.2024"
          },
          {
            "date": "2025-08-21",
            "formatted": "21.08.2025"
          }
        ],
        "unpaid": []
      },
      "stats": {
        "previousCompleted": 0,
        "currentPaidUsed": 12,
        "currentRemaining": 7,
        "currentUnpaid": 0,
        "totalCurrent": 19,
        "totalAllTime": 19
      },
      "lastUpdated": "2025-06-20"
    },
    {
      "id": "andrada-luncan",
      "name": "Andrada Luncan",
      "sessions": {
        "paid": [
          {
            "date": "2024-03-22",
            "formatted": "22.03.2024"
          },
          {
            "date": "2024-07-29",
            "formatted": "29.07.2024"
          },
          {
            "date": "2024-07-31",
            "formatted": "31.07.2024"
          },
          {
            "date": "2024-08-05",
            "formatted": "05.08.2024"
          },
          {
            "date": "2024-08-09",
            "formatted": "09.08.2024"
          },
          {
            "date": "2024-08-12",
            "formatted": "12.08.2024"
          },
          {
            "date": "2024-08-14",
            "formatted": "14.08.2024"
          },
          {
            "date": "2024-08-23",
            "formatted": "23.08.2024"
          },
          {
            "date": "2025-08-21",
            "formatted": "21.08.2025"
          },
          {
            "date": "2026-08-19",
            "formatted": "19.08.2026"
          },
          {
            "date": "2026-08-20",
            "formatted": "20.08.2026"
          },
          {
            "date": "2026-12-23",
            "formatted": "23.12.2026"
          },
          {
            "date": "2026-12-23",
            "formatted": "23.12.2026"
          },
          {
            "date": "2027-04-18",
            "formatted": "18.04.2027"
          }
        ],
        "unpaid": []
      },
      "stats": {
        "previousCompleted": 0,
        "currentPaidUsed": 14,
        "currentRemaining": 0,
        "currentUnpaid": 0,
        "totalCurrent": 14,
        "totalAllTime": 14
      },
      "lastUpdated": "2025-06-20"
    },
    {
      "id": "andreea-albu",
      "name": "Andreea Albu",
      "sessions": {
        "paid": [
          {
            "date": "2024-06-07",
            "formatted": "07.06.2024"
          },
          {
            "date": "2024-07-01",
            "formatted": "01.07.2024"
          },
          {
            "date": "2024-07-01",
            "formatted": "01.07.2024"
          },
          {
            "date": "2024-07-03",
            "formatted": "03.07.2024"
          },
          {
            "date": "2024-07-03",
            "formatted": "03.07.2024"
          },
          {
            "date": "2024-07-15",
            "formatted": "15.07.2024"
          },
          {
            "date": "2024-07-15",
            "formatted": "15.07.2024"
          },
          {
            "date": "2024-07-17",
            "formatted": "17.07.2024"
          },
          {
            "date": "2024-07-17",
            "formatted": "17.07.2024"
          },
          {
            "date": "2024-07-19",
            "formatted": "19.07.2024"
          },
          {
            "date": "2024-07-19",
            "formatted": "19.07.2024"
          },
          {
            "date": "2024-07-22",
            "formatted": "22.07.2024"
          },
          {
            "date": "2024-07-22",
            "formatted": "22.07.2024"
          },
          {
            "date": "2024-07-24",
            "formatted": "24.07.2024"
          },
          {
            "date": "2024-07-24",
            "formatted": "24.07.2024"
          },
          {
            "date": "2024-07-29",
            "formatted": "29.07.2024"
          },
          {
            "date": "2024-07-31",
            "formatted": "31.07.2024"
          },
          {
            "date": "2024-07-31",
            "formatted": "31.07.2024"
          },
          {
            "date": "2024-08-05",
            "formatted": "05.08.2024"
          },
          {
            "date": "2024-08-05",
            "formatted": "05.08.2024"
          },
          {
            "date": "2024-08-07",
            "formatted": "07.08.2024"
          },
          {
            "date": "2024-08-09",
            "formatted": "09.08.2024"
          },
          {
            "date": "2024-08-12",
            "formatted": "12.08.2024"
          },
          {
            "date": "2024-08-12",
            "formatted": "12.08.2024"
          },
          {
            "date": "2024-08-14",
            "formatted": "14.08.2024"
          },
          {
            "date": "2024-08-14",
            "formatted": "14.08.2024"
          },
          {
            "date": "2024-08-19",
            "formatted": "19.08.2024"
          },
          {
            "date": "2024-08-19",
            "formatted": "19.08.2024"
          },
          {
            "date": "2024-08-21",
            "formatted": "21.08.2024"
          },
          {
            "date": "2024-08-21",
            "formatted": "21.08.2024"
          },
          {
            "date": "2024-09-04",
            "formatted": "04.09.2024"
          },
          {
            "date": "2024-09-04",
            "formatted": "04.09.2024"
          },
          {
            "date": "2024-09-25",
            "formatted": "25.09.2024"
          },
          {
            "date": "2024-09-25",
            "formatted": "25.09.2024"
          },
          {
            "date": "2024-10-16",
            "formatted": "16.10.2024"
          },
          {
            "date": "2024-10-16",
            "formatted": "16.10.2024"
          },
          {
            "date": "2024-10-25",
            "formatted": "25.10.2024"
          },
          {
            "date": "2024-11-04",
            "formatted": "04.11.2024"
          },
          {
            "date": "2024-11-04",
            "formatted": "04.11.2024"
          },
          {
            "date": "2024-11-07",
            "formatted": "07.11.2024"
          },
          {
            "date": "2024-11-20",
            "formatted": "20.11.2024"
          },
          {
            "date": "2024-11-20",
            "formatted": "20.11.2024"
          },
          {
            "date": "2024-11-29",
            "formatted": "29.11.2024"
          },
          {
            "date": "2024-12-02",
            "formatted": "02.12.2024"
          },
          {
            "date": "2024-12-04",
            "formatted": "04.12.2024"
          },
          {
            "date": "2024-12-06",
            "formatted": "06.12.2024"
          },
          {
            "date": "2024-12-09",
            "formatted": "09.12.2024"
          },
          {
            "date": "2024-12-09",
            "formatted": "09.12.2024"
          },
          {
            "date": "2024-12-11",
            "formatted": "11.12.2024"
          },
          {
            "date": "2024-12-11",
            "formatted": "11.12.2024"
          },
          {
            "date": "2024-12-16",
            "formatted": "16.12.2024"
          },
          {
            "date": "2024-12-17",
            "formatted": "17.12.2024"
          },
          {
            "date": "2024-12-30",
            "formatted": "30.12.2024"
          },
          {
            "date": "2024-12-30",
            "formatted": "30.12.2024"
          },
          {
            "date": "2025-01-20",
            "formatted": "20.01.2025"
          },
          {
            "date": "2025-01-22",
            "formatted": "22.01.2025"
          },
          {
            "date": "2025-01-22",
            "formatted": "22.01.2025"
          },
          {
            "date": "2025-01-27",
            "formatted": "27.01.2025"
          },
          {
            "date": "2025-01-27",
            "formatted": "27.01.2025"
          },
          {
            "date": "2025-01-29",
            "formatted": "29.01.2025"
          },
          {
            "date": "2025-01-31",
            "formatted": "31.01.2025"
          },
          {
            "date": "2025-01-31",
            "formatted": "31.01.2025"
          },
          {
            "date": "2025-02-07",
            "formatted": "07.02.2025"
          },
          {
            "date": "2025-04-07",
            "formatted": "07.04.2025"
          },
          {
            "date": "2025-05-16",
            "formatted": "16.05.2025"
          },
          {
            "date": "2025-05-26",
            "formatted": "26.05.2025"
          }
        ],
        "unpaid": []
      },
      "stats": {
        "previousCompleted": 0,
        "currentPaidUsed": 66,
        "currentRemaining": 6,
        "currentUnpaid": 0,
        "totalCurrent": 72,
        "totalAllTime": 72
      },
      "lastUpdated": "2025-06-20"
    },
    {
      "id": "andreea-moldoveanu",
      "name": "Andreea Moldoveanu",
      "sessions": {
        "paid": [
          {
            "date": "2024-06-10",
            "formatted": "10.06.2024"
          },
          {
            "date": "2024-06-13",
            "formatted": "13.06.2024"
          },
          {
            "date": "2024-06-17",
            "formatted": "17.06.2024"
          },
          {
            "date": "2024-06-19",
            "formatted": "19.06.2024"
          },
          {
            "date": "2024-06-21",
            "formatted": "21.06.2024"
          },
          {
            "date": "2024-06-26",
            "formatted": "26.06.2024"
          },
          {
            "date": "2024-06-28",
            "formatted": "28.06.2024"
          },
          {
            "date": "2024-07-01",
            "formatted": "01.07.2024"
          },
          {
            "date": "2024-07-03",
            "formatted": "03.07.2024"
          },
          {
            "date": "2024-07-05",
            "formatted": "05.07.2024"
          },
          {
            "date": "2024-07-08",
            "formatted": "08.07.2024"
          },
          {
            "date": "2024-07-10",
            "formatted": "10.07.2024"
          },
          {
            "date": "2024-07-11",
            "formatted": "11.07.2024"
          },
          {
            "date": "2024-07-15",
            "formatted": "15.07.2024"
          },
          {
            "date": "2024-07-18",
            "formatted": "18.07.2024"
          },
          {
            "date": "2024-07-22",
            "formatted": "22.07.2024"
          },
          {
            "date": "2024-07-24",
            "formatted": "24.07.2024"
          },
          {
            "date": "2024-08-05",
            "formatted": "05.08.2024"
          },
          {
            "date": "2024-08-07",
            "formatted": "07.08.2024"
          },
          {
            "date": "2024-08-09",
            "formatted": "09.08.2024"
          },
          {
            "date": "2024-08-12",
            "formatted": "12.08.2024"
          },
          {
            "date": "2024-08-14",
            "formatted": "14.08.2024"
          },
          {
            "date": "2024-08-19",
            "formatted": "19.08.2024"
          },
          {
            "date": "2024-08-21",
            "formatted": "21.08.2024"
          },
          {
            "date": "2024-08-23",
            "formatted": "23.08.2024"
          },
          {
            "date": "2024-09-11",
            "formatted": "11.09.2024"
          },
          {
            "date": "2024-09-12",
            "formatted": "12.09.2024"
          },
          {
            "date": "2024-09-16",
            "formatted": "16.09.2024"
          },
          {
            "date": "2024-09-20",
            "formatted": "20.09.2024"
          },
          {
            "date": "2024-09-27",
            "formatted": "27.09.2024"
          },
          {
            "date": "2025-09-23",
            "formatted": "23.09.2025"
          },
          {
            "date": "2025-09-25",
            "formatted": "25.09.2025"
          },
          {
            "date": "2025-09-30",
            "formatted": "30.09.2025"
          },
          {
            "date": "2025-10-02",
            "formatted": "02.10.2025"
          },
          {
            "date": "2025-10-04",
            "formatted": "04.10.2025"
          },
          {
            "date": "2025-10-07",
            "formatted": "07.10.2025"
          },
          {
            "date": "2025-10-09",
            "formatted": "09.10.2025"
          },
          {
            "date": "2025-10-10",
            "formatted": "10.10.2025"
          },
          {
            "date": "2025-10-14",
            "formatted": "14.10.2025"
          },
          {
            "date": "2025-10-21",
            "formatted": "21.10.2025"
          },
          {
            "date": "2025-10-23",
            "formatted": "23.10.2025"
          },
          {
            "date": "2025-10-25",
            "formatted": "25.10.2025"
          },
          {
            "date": "2025-10-28",
            "formatted": "28.10.2025"
          },
          {
            "date": "2025-10-30",
            "formatted": "30.10.2025"
          },
          {
            "date": "2025-11-01",
            "formatted": "01.11.2025"
          },
          {
            "date": "2025-11-04",
            "formatted": "04.11.2025"
          },
          {
            "date": "2025-11-06",
            "formatted": "06.11.2025"
          },
          {
            "date": "2025-11-07",
            "formatted": "07.11.2025"
          },
          {
            "date": "2025-11-20",
            "formatted": "20.11.2025"
          },
          {
            "date": "2025-11-22",
            "formatted": "22.11.2025"
          },
          {
            "date": "2025-11-29",
            "formatted": "29.11.2025"
          },
          {
            "date": "2025-12-02",
            "formatted": "02.12.2025"
          },
          {
            "date": "2025-12-04",
            "formatted": "04.12.2025"
          },
          {
            "date": "2025-12-06",
            "formatted": "06.12.2025"
          },
          {
            "date": "2025-12-09",
            "formatted": "09.12.2025"
          },
          {
            "date": "2025-12-11",
            "formatted": "11.12.2025"
          },
          {
            "date": "2025-12-13",
            "formatted": "13.12.2025"
          },
          {
            "date": "2025-12-17",
            "formatted": "17.12.2025"
          },
          {
            "date": "2025-12-30",
            "formatted": "30.12.2025"
          },
          {
            "date": "2026-01-03",
            "formatted": "03.01.2026"
          },
          {
            "date": "2026-01-06",
            "formatted": "06.01.2026"
          },
          {
            "date": "2026-01-10",
            "formatted": "10.01.2026"
          },
          {
            "date": "2027-01-08",
            "formatted": "08.01.2027"
          },
          {
            "date": "2027-01-13",
            "formatted": "13.01.2027"
          },
          {
            "date": "2027-01-15",
            "formatted": "15.01.2027"
          },
          {
            "date": "2027-01-17",
            "formatted": "17.01.2027"
          },
          {
            "date": "2027-01-20",
            "formatted": "20.01.2027"
          },
          {
            "date": "2027-01-22",
            "formatted": "22.01.2027"
          },
          {
            "date": "2027-01-27",
            "formatted": "27.01.2027"
          },
          {
            "date": "2027-01-30",
            "formatted": "30.01.2027"
          },
          {
            "date": "2027-01-31",
            "formatted": "31.01.2027"
          },
          {
            "date": "2027-02-03",
            "formatted": "03.02.2027"
          },
          {
            "date": "2027-02-05",
            "formatted": "05.02.2027"
          },
          {
            "date": "2027-02-10",
            "formatted": "10.02.2027"
          },
          {
            "date": "2027-02-14",
            "formatted": "14.02.2027"
          },
          {
            "date": "2027-02-17",
            "formatted": "17.02.2027"
          },
          {
            "date": "2027-02-26",
            "formatted": "26.02.2027"
          },
          {
            "date": "2028-02-20",
            "formatted": "20.02.2028"
          },
          {
            "date": "2028-02-28",
            "formatted": "28.02.2028"
          },
          {
            "date": "2028-03-03",
            "formatted": "03.03.2028"
          },
          {
            "date": "2028-03-05",
            "formatted": "05.03.2028"
          },
          {
            "date": "2028-03-07",
            "formatted": "07.03.2028"
          },
          {
            "date": "2028-03-10",
            "formatted": "10.03.2028"
          },
          {
            "date": "2028-03-14",
            "formatted": "14.03.2028"
          },
          {
            "date": "2028-03-17",
            "formatted": "17.03.2028"
          },
          {
            "date": "2028-03-21",
            "formatted": "21.03.2028"
          },
          {
            "date": "2028-03-24",
            "formatted": "24.03.2028"
          },
          {
            "date": "2028-03-26",
            "formatted": "26.03.2028"
          },
          {
            "date": "2028-03-27",
            "formatted": "27.03.2028"
          },
          {
            "date": "2028-03-31",
            "formatted": "31.03.2028"
          },
          {
            "date": "2028-04-14",
            "formatted": "14.04.2028"
          },
          {
            "date": "2028-04-30",
            "formatted": "30.04.2028"
          },
          {
            "date": "2028-05-12",
            "formatted": "12.05.2028"
          },
          {
            "date": "2028-05-14",
            "formatted": "14.05.2028"
          },
          {
            "date": "2028-05-21",
            "formatted": "21.05.2028"
          },
          {
            "date": "2028-06-04",
            "formatted": "04.06.2028"
          }
        ],
        "unpaid": []
      },
      "stats": {
        "previousCompleted": 140,
        "currentPaidUsed": 96,
        "currentRemaining": 5,
        "currentUnpaid": 0,
        "totalCurrent": 101,
        "totalAllTime": 241
      },
      "lastUpdated": "2025-06-20"
    },
    {
      "id": "andreea-simionas",
      "name": "Andreea Simionas",
      "sessions": {
        "paid": [
          {
            "date": "2024-06-10",
            "formatted": "10.06.2024"
          },
          {
            "date": "2024-06-13",
            "formatted": "13.06.2024"
          },
          {
            "date": "2024-06-19",
            "formatted": "19.06.2024"
          },
          {
            "date": "2024-06-20",
            "formatted": "20.06.2024"
          },
          {
            "date": "2024-06-26",
            "formatted": "26.06.2024"
          },
          {
            "date": "2024-07-01",
            "formatted": "01.07.2024"
          },
          {
            "date": "2024-07-04",
            "formatted": "04.07.2024"
          },
          {
            "date": "2024-07-22",
            "formatted": "22.07.2024"
          },
          {
            "date": "2024-07-25",
            "formatted": "25.07.2024"
          },
          {
            "date": "2024-08-14",
            "formatted": "14.08.2024"
          },
          {
            "date": "2024-08-21",
            "formatted": "21.08.2024"
          },
          {
            "date": "2024-09-04",
            "formatted": "04.09.2024"
          },
          {
            "date": "2024-09-16",
            "formatted": "16.09.2024"
          },
          {
            "date": "2024-09-18",
            "formatted": "18.09.2024"
          },
          {
            "date": "2024-09-25",
            "formatted": "25.09.2024"
          },
          {
            "date": "2024-11-04",
            "formatted": "04.11.2024"
          },
          {
            "date": "2024-11-06",
            "formatted": "06.11.2024"
          },
          {
            "date": "2024-11-08",
            "formatted": "08.11.2024"
          }
        ],
        "unpaid": []
      },
      "stats": {
        "previousCompleted": 0,
        "currentPaidUsed": 18,
        "currentRemaining": 2,
        "currentUnpaid": 0,
        "totalCurrent": 20,
        "totalAllTime": 20
      },
      "lastUpdated": "2025-06-20"
    },
    {
      "id": "andrei-vilcovan",
      "name": "Andrei Vilcovan",
      "sessions": {
        "paid": [
          {
            "date": "2024-02-19",
            "formatted": "19.02.2024"
          },
          {
            "date": "2024-02-21",
            "formatted": "21.02.2024"
          }
        ],
        "unpaid": []
      },
      "stats": {
        "previousCompleted": 0,
        "currentPaidUsed": 2,
        "currentRemaining": 8,
        "currentUnpaid": 0,
        "totalCurrent": 10,
        "totalAllTime": 10
      },
      "lastUpdated": "2025-06-20"
    },
    {
      "id": "anna-morska",
      "name": "Anna Morska",
      "sessions": {
        "paid": [
          {
            "date": "2024-06-03",
            "formatted": "03.06.2024"
          },
          {
            "date": "2024-08-05",
            "formatted": "05.08.2024"
          },
          {
            "date": "2024-08-12",
            "formatted": "12.08.2024"
          },
          {
            "date": "2024-08-20",
            "formatted": "20.08.2024"
          },
          {
            "date": "2024-08-22",
            "formatted": "22.08.2024"
          },
          {
            "date": "2024-09-16",
            "formatted": "16.09.2024"
          },
          {
            "date": "2024-10-23",
            "formatted": "23.10.2024"
          },
          {
            "date": "2025-03-17",
            "formatted": "17.03.2025"
          },
          {
            "date": "2025-04-08",
            "formatted": "08.04.2025"
          },
          {
            "date": "2025-05-06",
            "formatted": "06.05.2025"
          },
          {
            "date": "2025-06-12",
            "formatted": "12.06.2025"
          },
          {
            "date": "2025-06-16",
            "formatted": "16.06.2025"
          }
        ],
        "unpaid": []
      },
      "stats": {
        "previousCompleted": 0,
        "currentPaidUsed": 12,
        "currentRemaining": 1,
        "currentUnpaid": 0,
        "totalCurrent": 13,
        "totalAllTime": 13
      },
      "lastUpdated": "2025-06-20"
    },
    {
      "id": "anna-vasilieva",
      "name": "Anna Vasilieva",
      "sessions": {
        "paid": [
          {
            "date": "2024-03-01",
            "formatted": "01.03.2024"
          }
        ],
        "unpaid": []
      },
      "stats": {
        "previousCompleted": 0,
        "currentPaidUsed": 1,
        "currentRemaining": 0,
        "currentUnpaid": 0,
        "totalCurrent": 1,
        "totalAllTime": 1
      },
      "lastUpdated": "2025-06-20"
    },
    {
      "id": "bella-lenghen",
      "name": "Bella Lenghen",
      "sessions": {
        "paid": [
          {
            "date": "2024-05-22",
            "formatted": "22.05.2024"
          }
        ],
        "unpaid": []
      },
      "stats": {
        "previousCompleted": 0,
        "currentPaidUsed": 1,
        "currentRemaining": 9,
        "currentUnpaid": 0,
        "totalCurrent": 10,
        "totalAllTime": 10
      },
      "lastUpdated": "2025-06-20"
    },
    {
      "id": "bianca-plitea",
      "name": "Bianca Plitea",
      "sessions": {
        "paid": [
          {
            "date": "2024-06-06",
            "formatted": "06.06.2024"
          },
          {
            "date": "2024-06-10",
            "formatted": "10.06.2024"
          },
          {
            "date": "2024-06-11",
            "formatted": "11.06.2024"
          },
          {
            "date": "2024-06-17",
            "formatted": "17.06.2024"
          },
          {
            "date": "2024-06-18",
            "formatted": "18.06.2024"
          },
          {
            "date": "2024-06-24",
            "formatted": "24.06.2024"
          },
          {
            "date": "2024-06-25",
            "formatted": "25.06.2024"
          },
          {
            "date": "2024-07-09",
            "formatted": "09.07.2024"
          },
          {
            "date": "2024-07-11",
            "formatted": "11.07.2024"
          }
        ],
        "unpaid": []
      },
      "stats": {
        "previousCompleted": 0,
        "currentPaidUsed": 9,
        "currentRemaining": 1,
        "currentUnpaid": 0,
        "totalCurrent": 10,
        "totalAllTime": 10
      },
      "lastUpdated": "2025-06-20"
    },
    {
      "id": "bianca-ursachi",
      "name": "Bianca Ursachi",
      "sessions": {
        "paid": [
          {
            "date": "2024-06-05",
            "formatted": "05.06.2024"
          }
        ],
        "unpaid": []
      },
      "stats": {
        "previousCompleted": 0,
        "currentPaidUsed": 1,
        "currentRemaining": 3,
        "currentUnpaid": 0,
        "totalCurrent": 4,
        "totalAllTime": 4
      },
      "lastUpdated": "2025-06-20"
    },
    {
      "id": "bogdan-scarlat",
      "name": "Bogdan Scarlat",
      "sessions": {
        "paid": [
          {
            "date": "2024-05-16",
            "formatted": "16.05.2024"
          },
          {
            "date": "2024-06-17",
            "formatted": "17.06.2024"
          },
          {
            "date": "2024-06-18",
            "formatted": "18.06.2024"
          },
          {
            "date": "2024-07-01",
            "formatted": "01.07.2024"
          },
          {
            "date": "2024-07-02",
            "formatted": "02.07.2024"
          },
          {
            "date": "2024-07-04",
            "formatted": "04.07.2024"
          },
          {
            "date": "2024-07-09",
            "formatted": "09.07.2024"
          },
          {
            "date": "2024-07-15",
            "formatted": "15.07.2024"
          },
          {
            "date": "2025-07-11",
            "formatted": "11.07.2025"
          },
          {
            "date": "2025-07-16",
            "formatted": "16.07.2025"
          },
          {
            "date": "2025-08-08",
            "formatted": "08.08.2025"
          },
          {
            "date": "2025-08-13",
            "formatted": "13.08.2025"
          },
          {
            "date": "2025-08-20",
            "formatted": "20.08.2025"
          },
          {
            "date": "2025-09-12",
            "formatted": "12.09.2025"
          },
          {
            "date": "2025-09-17",
            "formatted": "17.09.2025"
          },
          {
            "date": "2025-11-05",
            "formatted": "05.11.2025"
          },
          {
            "date": "2025-11-07",
            "formatted": "07.11.2025"
          },
          {
            "date": "2025-11-19",
            "formatted": "19.11.2025"
          },
          {
            "date": "2025-11-21",
            "formatted": "21.11.2025"
          },
          {
            "date": "2025-11-26",
            "formatted": "26.11.2025"
          },
          {
            "date": "2025-11-28",
            "formatted": "28.11.2025"
          },
          {
            "date": "2025-12-03",
            "formatted": "03.12.2025"
          },
          {
            "date": "2025-12-05",
            "formatted": "05.12.2025"
          },
          {
            "date": "2025-12-10",
            "formatted": "10.12.2025"
          },
          {
            "date": "2025-12-12",
            "formatted": "12.12.2025"
          },
          {
            "date": "2026-01-06",
            "formatted": "06.01.2026"
          },
          {
            "date": "2026-01-07",
            "formatted": "07.01.2026"
          },
          {
            "date": "2026-01-09",
            "formatted": "09.01.2026"
          },
          {
            "date": "2026-01-14",
            "formatted": "14.01.2026"
          },
          {
            "date": "2026-01-16",
            "formatted": "16.01.2026"
          },
          {
            "date": "2026-01-21",
            "formatted": "21.01.2026"
          },
          {
            "date": "2026-01-23",
            "formatted": "23.01.2026"
          },
          {
            "date": "2026-01-28",
            "formatted": "28.01.2026"
          },
          {
            "date": "2026-01-30",
            "formatted": "30.01.2026"
          },
          {
            "date": "2026-02-04",
            "formatted": "04.02.2026"
          },
          {
            "date": "2026-02-11",
            "formatted": "11.02.2026"
          },
          {
            "date": "2026-02-13",
            "formatted": "13.02.2026"
          },
          {
            "date": "2026-03-18",
            "formatted": "18.03.2026"
          },
          {
            "date": "2026-05-06",
            "formatted": "06.05.2026"
          }
        ],
        "unpaid": []
      },
      "stats": {
        "previousCompleted": 0,
        "currentPaidUsed": 39,
        "currentRemaining": 0,
        "currentUnpaid": 0,
        "totalCurrent": 39,
        "totalAllTime": 39
      },
      "lastUpdated": "2025-06-20"
    },
    {
      "id": "cami-szekely",
      "name": "Cami Szekely",
      "sessions": {
        "paid": [
          {
            "date": "2024-04-05",
            "formatted": "05.04.2024"
          }
        ],
        "unpaid": []
      },
      "stats": {
        "previousCompleted": 0,
        "currentPaidUsed": 1,
        "currentRemaining": 0,
        "currentUnpaid": 0,
        "totalCurrent": 1,
        "totalAllTime": 1
      },
      "lastUpdated": "2025-06-20"
    },
    {
      "id": "carmen-pascu",
      "name": "Carmen Pascu",
      "sessions": {
        "paid": [
          {
            "date": "2024-06-10",
            "formatted": "10.06.2024"
          },
          {
            "date": "2024-06-12",
            "formatted": "12.06.2024"
          },
          {
            "date": "2024-06-14",
            "formatted": "14.06.2024"
          },
          {
            "date": "2024-06-17",
            "formatted": "17.06.2024"
          },
          {
            "date": "2024-06-18",
            "formatted": "18.06.2024"
          },
          {
            "date": "2024-06-19",
            "formatted": "19.06.2024"
          },
          {
            "date": "2024-06-20",
            "formatted": "20.06.2024"
          },
          {
            "date": "2024-06-21",
            "formatted": "21.06.2024"
          },
          {
            "date": "2024-07-01",
            "formatted": "01.07.2024"
          },
          {
            "date": "2024-07-04",
            "formatted": "04.07.2024"
          },
          {
            "date": "2024-07-05",
            "formatted": "05.07.2024"
          },
          {
            "date": "2024-07-10",
            "formatted": "10.07.2024"
          },
          {
            "date": "2024-07-11",
            "formatted": "11.07.2024"
          },
          {
            "date": "2024-08-05",
            "formatted": "05.08.2024"
          },
          {
            "date": "2024-08-21",
            "formatted": "21.08.2024"
          },
          {
            "date": "2025-08-19",
            "formatted": "19.08.2025"
          }
        ],
        "unpaid": []
      },
      "stats": {
        "previousCompleted": 170,
        "currentPaidUsed": 16,
        "currentRemaining": 3,
        "currentUnpaid": 0,
        "totalCurrent": 19,
        "totalAllTime": 189
      },
      "lastUpdated": "2025-06-20"
    },
    {
      "id": "carmen-stanese",
      "name": "Carmen Stanese",
      "sessions": {
        "paid": [
          {
            "date": "2024-06-10",
            "formatted": "10.06.2024"
          },
          {
            "date": "2024-06-28",
            "formatted": "28.06.2024"
          },
          {
            "date": "2024-07-01",
            "formatted": "01.07.2024"
          },
          {
            "date": "2024-07-05",
            "formatted": "05.07.2024"
          },
          {
            "date": "2024-07-08",
            "formatted": "08.07.2024"
          },
          {
            "date": "2024-07-11",
            "formatted": "11.07.2024"
          },
          {
            "date": "2025-07-10",
            "formatted": "10.07.2025"
          },
          {
            "date": "2025-07-15",
            "formatted": "15.07.2025"
          },
          {
            "date": "2025-07-17",
            "formatted": "17.07.2025"
          },
          {
            "date": "2025-07-19",
            "formatted": "19.07.2025"
          },
          {
            "date": "2025-07-22",
            "formatted": "22.07.2025"
          },
          {
            "date": "2025-07-24",
            "formatted": "24.07.2025"
          },
          {
            "date": "2025-07-25",
            "formatted": "25.07.2025"
          }
        ],
        "unpaid": []
      },
      "stats": {
        "previousCompleted": 150,
        "currentPaidUsed": 13,
        "currentRemaining": 0,
        "currentUnpaid": 0,
        "totalCurrent": 13,
        "totalAllTime": 163
      },
      "lastUpdated": "2025-06-20"
    },
    {
      "id": "alexandra",
      "name": "Alexandra",
      "sessions": {
        "paid": [
          {
            "date": "2024-07-29",
            "formatted": "29.07.2024"
          },
          {
            "date": "2024-07-31",
            "formatted": "31.07.2024"
          },
          {
            "date": "2024-08-09",
            "formatted": "09.08.2024"
          },
          {
            "date": "2025-08-07",
            "formatted": "07.08.2025"
          },
          {
            "date": "2025-08-14",
            "formatted": "14.08.2025"
          },
          {
            "date": "2025-08-19",
            "formatted": "19.08.2025"
          },
          {
            "date": "2025-08-21",
            "formatted": "21.08.2025"
          },
          {
            "date": "2025-08-23",
            "formatted": "23.08.2025"
          },
          {
            "date": "2025-09-04",
            "formatted": "04.09.2025"
          },
          {
            "date": "2025-09-09",
            "formatted": "09.09.2025"
          },
          {
            "date": "2025-09-11",
            "formatted": "11.09.2025"
          },
          {
            "date": "2025-09-12",
            "formatted": "12.09.2025"
          },
          {
            "date": "2025-09-16",
            "formatted": "16.09.2025"
          },
          {
            "date": "2025-09-18",
            "formatted": "18.09.2025"
          },
          {
            "date": "2025-09-20",
            "formatted": "20.09.2025"
          },
          {
            "date": "2025-09-25",
            "formatted": "25.09.2025"
          },
          {
            "date": "2026-09-23",
            "formatted": "23.09.2026"
          },
          {
            "date": "2026-10-02",
            "formatted": "02.10.2026"
          },
          {
            "date": "2026-10-04",
            "formatted": "04.10.2026"
          },
          {
            "date": "2026-10-07",
            "formatted": "07.10.2026"
          },
          {
            "date": "2026-10-09",
            "formatted": "09.10.2026"
          },
          {
            "date": "2026-10-10",
            "formatted": "10.10.2026"
          },
          {
            "date": "2026-10-14",
            "formatted": "14.10.2026"
          },
          {
            "date": "2026-10-16",
            "formatted": "16.10.2026"
          },
          {
            "date": "2026-10-21",
            "formatted": "21.10.2026"
          },
          {
            "date": "2026-10-23",
            "formatted": "23.10.2026"
          },
          {
            "date": "2026-10-25",
            "formatted": "25.10.2026"
          },
          {
            "date": "2026-10-28",
            "formatted": "28.10.2026"
          },
          {
            "date": "2026-10-30",
            "formatted": "30.10.2026"
          },
          {
            "date": "2026-11-01",
            "formatted": "01.11.2026"
          },
          {
            "date": "2026-11-04",
            "formatted": "04.11.2026"
          },
          {
            "date": "2026-11-06",
            "formatted": "06.11.2026"
          },
          {
            "date": "2026-11-07",
            "formatted": "07.11.2026"
          },
          {
            "date": "2026-11-11",
            "formatted": "11.11.2026"
          },
          {
            "date": "2026-11-15",
            "formatted": "15.11.2026"
          },
          {
            "date": "2026-11-18",
            "formatted": "18.11.2026"
          },
          {
            "date": "2026-11-20",
            "formatted": "20.11.2026"
          },
          {
            "date": "2026-11-22",
            "formatted": "22.11.2026"
          },
          {
            "date": "2026-11-27",
            "formatted": "27.11.2026"
          },
          {
            "date": "2026-12-06",
            "formatted": "06.12.2026"
          },
          {
            "date": "2026-12-09",
            "formatted": "09.12.2026"
          },
          {
            "date": "2026-12-17",
            "formatted": "17.12.2026"
          },
          {
            "date": "2026-12-19",
            "formatted": "19.12.2026"
          },
          {
            "date": "2026-12-23",
            "formatted": "23.12.2026"
          },
          {
            "date": "2027-01-07",
            "formatted": "07.01.2027"
          },
          {
            "date": "2027-01-08",
            "formatted": "08.01.2027"
          },
          {
            "date": "2027-01-13",
            "formatted": "13.01.2027"
          },
          {
            "date": "2027-01-15",
            "formatted": "15.01.2027"
          },
          {
            "date": "2027-01-17",
            "formatted": "17.01.2027"
          },
          {
            "date": "2027-01-27",
            "formatted": "27.01.2027"
          },
          {
            "date": "2027-01-30",
            "formatted": "30.01.2027"
          },
          {
            "date": "2027-01-31",
            "formatted": "31.01.2027"
          },
          {
            "date": "2027-02-03",
            "formatted": "03.02.2027"
          },
          {
            "date": "2027-02-05",
            "formatted": "05.02.2027"
          },
          {
            "date": "2027-02-14",
            "formatted": "14.02.2027"
          },
          {
            "date": "2027-02-17",
            "formatted": "17.02.2027"
          },
          {
            "date": "2027-02-21",
            "formatted": "21.02.2027"
          },
          {
            "date": "2027-02-26",
            "formatted": "26.02.2027"
          },
          {
            "date": "2027-03-14",
            "formatted": "14.03.2027"
          },
          {
            "date": "2027-03-17",
            "formatted": "17.03.2027"
          },
          {
            "date": "2027-03-24",
            "formatted": "24.03.2027"
          },
          {
            "date": "2027-03-26",
            "formatted": "26.03.2027"
          },
          {
            "date": "2027-03-27",
            "formatted": "27.03.2027"
          },
          {
            "date": "2027-03-31",
            "formatted": "31.03.2027"
          },
          {
            "date": "2027-04-02",
            "formatted": "02.04.2027"
          },
          {
            "date": "2027-04-04",
            "formatted": "04.04.2027"
          },
          {
            "date": "2027-04-14",
            "formatted": "14.04.2027"
          },
          {
            "date": "2028-04-07",
            "formatted": "07.04.2028"
          },
          {
            "date": "2028-04-25",
            "formatted": "25.04.2028"
          },
          {
            "date": "2028-04-28",
            "formatted": "28.04.2028"
          },
          {
            "date": "2028-04-30",
            "formatted": "30.04.2028"
          },
          {
            "date": "2028-05-05",
            "formatted": "05.05.2028"
          },
          {
            "date": "2028-05-07",
            "formatted": "07.05.2028"
          },
          {
            "date": "2028-05-14",
            "formatted": "14.05.2028"
          },
          {
            "date": "2028-05-16",
            "formatted": "16.05.2028"
          },
          {
            "date": "2028-05-26",
            "formatted": "26.05.2028"
          },
          {
            "date": "2028-05-28",
            "formatted": "28.05.2028"
          },
          {
            "date": "2028-06-02",
            "formatted": "02.06.2028"
          },
          {
            "date": "2028-06-04",
            "formatted": "04.06.2028"
          },
          {
            "date": "2028-06-06",
            "formatted": "06.06.2028"
          },
          {
            "date": "2028-06-09",
            "formatted": "09.06.2028"
          },
          {
            "date": "2028-06-11",
            "formatted": "11.06.2028"
          }
        ],
        "unpaid": []
      },
      "stats": {
        "previousCompleted": 0,
        "currentPaidUsed": 82,
        "currentRemaining": 8,
        "currentUnpaid": 0,
        "totalCurrent": 90,
        "totalAllTime": 90
      },
      "lastUpdated": "2025-06-20"
    },
    {
      "id": "catalin-muresan",
      "name": "Catalin Muresan",
      "sessions": {
        "paid": [
          {
            "date": "2024-06-10",
            "formatted": "10.06.2024"
          },
          {
            "date": "2024-06-17",
            "formatted": "17.06.2024"
          },
          {
            "date": "2024-06-24",
            "formatted": "24.06.2024"
          },
          {
            "date": "2024-07-08",
            "formatted": "08.07.2024"
          },
          {
            "date": "2024-07-22",
            "formatted": "22.07.2024"
          },
          {
            "date": "2024-08-05",
            "formatted": "05.08.2024"
          },
          {
            "date": "2024-08-12",
            "formatted": "12.08.2024"
          },
          {
            "date": "2024-09-13",
            "formatted": "13.09.2024"
          },
          {
            "date": "2024-09-20",
            "formatted": "20.09.2024"
          },
          {
            "date": "2024-10-04",
            "formatted": "04.10.2024"
          },
          {
            "date": "2024-10-07",
            "formatted": "07.10.2024"
          },
          {
            "date": "2024-10-09",
            "formatted": "09.10.2024"
          },
          {
            "date": "2024-10-18",
            "formatted": "18.10.2024"
          },
          {
            "date": "2024-10-23",
            "formatted": "23.10.2024"
          },
          {
            "date": "2024-10-28",
            "formatted": "28.10.2024"
          },
          {
            "date": "2024-10-30",
            "formatted": "30.10.2024"
          },
          {
            "date": "2024-11-01",
            "formatted": "01.11.2024"
          },
          {
            "date": "2024-11-04",
            "formatted": "04.11.2024"
          },
          {
            "date": "2024-11-06",
            "formatted": "06.11.2024"
          },
          {
            "date": "2024-11-08",
            "formatted": "08.11.2024"
          },
          {
            "date": "2024-11-11",
            "formatted": "11.11.2024"
          },
          {
            "date": "2024-11-15",
            "formatted": "15.11.2024"
          },
          {
            "date": "2024-11-18",
            "formatted": "18.11.2024"
          },
          {
            "date": "2024-11-20",
            "formatted": "20.11.2024"
          },
          {
            "date": "2024-11-22",
            "formatted": "22.11.2024"
          },
          {
            "date": "2024-11-25",
            "formatted": "25.11.2024"
          },
          {
            "date": "2024-11-27",
            "formatted": "27.11.2024"
          },
          {
            "date": "2024-11-29",
            "formatted": "29.11.2024"
          },
          {
            "date": "2024-12-02",
            "formatted": "02.12.2024"
          },
          {
            "date": "2024-12-13",
            "formatted": "13.12.2024"
          },
          {
            "date": "2024-12-16",
            "formatted": "16.12.2024"
          },
          {
            "date": "2024-12-18",
            "formatted": "18.12.2024"
          },
          {
            "date": "2024-12-19",
            "formatted": "19.12.2024"
          },
          {
            "date": "2025-01-08",
            "formatted": "08.01.2025"
          },
          {
            "date": "2025-01-10",
            "formatted": "10.01.2025"
          },
          {
            "date": "2025-01-10",
            "formatted": "10.01.2025"
          },
          {
            "date": "2025-01-13",
            "formatted": "13.01.2025"
          },
          {
            "date": "2025-01-15",
            "formatted": "15.01.2025"
          },
          {
            "date": "2025-01-17",
            "formatted": "17.01.2025"
          },
          {
            "date": "2025-01-17",
            "formatted": "17.01.2025"
          },
          {
            "date": "2025-01-20",
            "formatted": "20.01.2025"
          },
          {
            "date": "2025-01-20",
            "formatted": "20.01.2025"
          },
          {
            "date": "2025-01-22",
            "formatted": "22.01.2025"
          },
          {
            "date": "2025-01-22",
            "formatted": "22.01.2025"
          },
          {
            "date": "2025-01-27",
            "formatted": "27.01.2025"
          },
          {
            "date": "2025-01-27",
            "formatted": "27.01.2025"
          },
          {
            "date": "2025-01-29",
            "formatted": "29.01.2025"
          },
          {
            "date": "2025-01-29",
            "formatted": "29.01.2025"
          },
          {
            "date": "2025-01-31",
            "formatted": "31.01.2025"
          },
          {
            "date": "2025-02-03",
            "formatted": "03.02.2025"
          },
          {
            "date": "2025-02-03",
            "formatted": "03.02.2025"
          },
          {
            "date": "2025-02-05",
            "formatted": "05.02.2025"
          },
          {
            "date": "2025-02-05",
            "formatted": "05.02.2025"
          },
          {
            "date": "2025-02-07",
            "formatted": "07.02.2025"
          },
          {
            "date": "2025-02-07",
            "formatted": "07.02.2025"
          },
          {
            "date": "2025-02-10",
            "formatted": "10.02.2025"
          },
          {
            "date": "2025-02-12",
            "formatted": "12.02.2025"
          },
          {
            "date": "2025-02-12",
            "formatted": "12.02.2025"
          },
          {
            "date": "2025-02-14",
            "formatted": "14.02.2025"
          },
          {
            "date": "2025-02-14",
            "formatted": "14.02.2025"
          },
          {
            "date": "2025-02-17",
            "formatted": "17.02.2025"
          },
          {
            "date": "2025-02-17",
            "formatted": "17.02.2025"
          },
          {
            "date": "2025-03-03",
            "formatted": "03.03.2025"
          },
          {
            "date": "2025-03-03",
            "formatted": "03.03.2025"
          },
          {
            "date": "2025-03-10",
            "formatted": "10.03.2025"
          },
          {
            "date": "2025-03-10",
            "formatted": "10.03.2025"
          },
          {
            "date": "2025-03-12",
            "formatted": "12.03.2025"
          },
          {
            "date": "2025-03-12",
            "formatted": "12.03.2025"
          },
          {
            "date": "2025-03-14",
            "formatted": "14.03.2025"
          },
          {
            "date": "2025-03-14",
            "formatted": "14.03.2025"
          },
          {
            "date": "2025-03-17",
            "formatted": "17.03.2025"
          },
          {
            "date": "2025-03-17",
            "formatted": "17.03.2025"
          },
          {
            "date": "2025-03-21",
            "formatted": "21.03.2025"
          },
          {
            "date": "2025-03-21",
            "formatted": "21.03.2025"
          },
          {
            "date": "2025-03-24",
            "formatted": "24.03.2025"
          },
          {
            "date": "2025-03-24",
            "formatted": "24.03.2025"
          },
          {
            "date": "2025-03-26",
            "formatted": "26.03.2025"
          },
          {
            "date": "2025-03-26",
            "formatted": "26.03.2025"
          },
          {
            "date": "2025-03-28",
            "formatted": "28.03.2025"
          },
          {
            "date": "2025-03-28",
            "formatted": "28.03.2025"
          },
          {
            "date": "2025-03-31",
            "formatted": "31.03.2025"
          },
          {
            "date": "2025-04-02",
            "formatted": "02.04.2025"
          },
          {
            "date": "2025-04-02",
            "formatted": "02.04.2025"
          },
          {
            "date": "2025-04-04",
            "formatted": "04.04.2025"
          },
          {
            "date": "2025-04-04",
            "formatted": "04.04.2025"
          },
          {
            "date": "2025-04-09",
            "formatted": "09.04.2025"
          },
          {
            "date": "2025-04-16",
            "formatted": "16.04.2025"
          },
          {
            "date": "2025-04-16",
            "formatted": "16.04.2025"
          },
          {
            "date": "2025-04-18",
            "formatted": "18.04.2025"
          },
          {
            "date": "2025-04-18",
            "formatted": "18.04.2025"
          },
          {
            "date": "2025-04-30",
            "formatted": "30.04.2025"
          },
          {
            "date": "2025-04-30",
            "formatted": "30.04.2025"
          },
          {
            "date": "2025-05-05",
            "formatted": "05.05.2025"
          },
          {
            "date": "2025-05-05",
            "formatted": "05.05.2025"
          },
          {
            "date": "2025-05-07",
            "formatted": "07.05.2025"
          },
          {
            "date": "2025-05-07",
            "formatted": "07.05.2025"
          },
          {
            "date": "2025-05-12",
            "formatted": "12.05.2025"
          },
          {
            "date": "2025-05-14",
            "formatted": "14.05.2025"
          },
          {
            "date": "2025-05-16",
            "formatted": "16.05.2025"
          },
          {
            "date": "2025-05-16",
            "formatted": "16.05.2025"
          },
          {
            "date": "2025-05-19",
            "formatted": "19.05.2025"
          },
          {
            "date": "2025-05-19",
            "formatted": "19.05.2025"
          },
          {
            "date": "2025-05-26",
            "formatted": "26.05.2025"
          },
          {
            "date": "2025-05-28",
            "formatted": "28.05.2025"
          },
          {
            "date": "2025-05-28",
            "formatted": "28.05.2025"
          },
          {
            "date": "2025-05-30",
            "formatted": "30.05.2025"
          },
          {
            "date": "2025-06-02",
            "formatted": "02.06.2025"
          },
          {
            "date": "2025-06-02",
            "formatted": "02.06.2025"
          },
          {
            "date": "2025-06-04",
            "formatted": "04.06.2025"
          },
          {
            "date": "2025-06-06",
            "formatted": "06.06.2025"
          },
          {
            "date": "2025-06-09",
            "formatted": "09.06.2025"
          },
          {
            "date": "2025-06-11",
            "formatted": "11.06.2025"
          },
          {
            "date": "2025-06-16",
            "formatted": "16.06.2025"
          },
          {
            "date": "2025-06-16",
            "formatted": "16.06.2025"
          }
        ],
        "unpaid": []
      },
      "stats": {
        "previousCompleted": 160,
        "currentPaidUsed": 114,
        "currentRemaining": 9,
        "currentUnpaid": 0,
        "totalCurrent": 123,
        "totalAllTime": 283
      },
      "lastUpdated": "2025-06-20",
      "extra": [
        {
          "date": "17.2",
          "text": "diana"
        },
        {
          "date": "3.3",
          "text": "diana"
        },
        {
          "date": "10.3",
          "text": "diana"
        },
        {
          "date": "12.3",
          "text": "diana"
        },
        {
          "date": "14.3",
          "text": "diana"
        },
        {
          "date": "17.3",
          "text": "diana"
        },
        {
          "date": "21.3",
          "text": "diana"
        },
        {
          "date": "24.3",
          "text": "diana"
        },
        {
          "date": "26.3",
          "text": "diana"
        },
        {
          "date": "28.3",
          "text": "diana"
        },
        {
          "date": "2.4",
          "text": "diana"
        },
        {
          "date": "4.4",
          "text": "diana"
        },
        {
          "date": "9.4",
          "text": "diana"
        },
        {
          "date": "16.4",
          "text": "diana"
        },
        {
          "date": "18.4",
          "text": "diana"
        },
        {
          "date": "30.4",
          "text": "diana"
        },
        {
          "date": "5.5",
          "text": "diana"
        },
        {
          "date": "7.5",
          "text": "diana"
        },
        {
          "date": "16.5",
          "text": "diana"
        },
        {
          "date": "19.5",
          "text": "diana"
        },
        {
          "date": "28.5",
          "text": "diana"
        },
        {
          "date": "2.6",
          "text": "diana"
        },
        {
          "date": "4.6",
          "text": "diana"
        },
        {
          "date": "6.6",
          "text": "diana"
        },
        {
          "date": "11.6",
          "text": "diana"
        },
        {
          "date": "16.6",
          "text": "diana"
        }
      ]
    },
    {
      "id": "cecilia-giurgiu",
      "name": "Cecilia Giurgiu",
      "sessions": {
        "paid": [
          {
            "date": "2024-06-10",
            "formatted": "10.06.2024"
          },
          {
            "date": "2024-07-08",
            "formatted": "08.07.2024"
          }
        ],
        "unpaid": []
      },
      "stats": {
        "previousCompleted": 0,
        "currentPaidUsed": 2,
        "currentRemaining": 1,
        "currentUnpaid": 0,
        "totalCurrent": 3,
        "totalAllTime": 3
      },
      "lastUpdated": "2025-06-20"
    },
    {
      "id": "claudia-barbieru",
      "name": "Claudia Barbieru",
      "sessions": {
        "paid": [
          {
            "date": "2024-06-10",
            "formatted": "10.06.2024"
          },
          {
            "date": "2024-06-11",
            "formatted": "11.06.2024"
          },
          {
            "date": "2024-06-20",
            "formatted": "20.06.2024"
          },
          {
            "date": "2024-06-25",
            "formatted": "25.06.2024"
          },
          {
            "date": "2024-07-01",
            "formatted": "01.07.2024"
          },
          {
            "date": "2024-07-02",
            "formatted": "02.07.2024"
          },
          {
            "date": "2024-07-09",
            "formatted": "09.07.2024"
          },
          {
            "date": "2024-07-11",
            "formatted": "11.07.2024"
          },
          {
            "date": "2024-07-15",
            "formatted": "15.07.2024"
          },
          {
            "date": "2024-07-23",
            "formatted": "23.07.2024"
          },
          {
            "date": "2024-07-25",
            "formatted": "25.07.2024"
          },
          {
            "date": "2024-08-01",
            "formatted": "01.08.2024"
          },
          {
            "date": "2024-08-19",
            "formatted": "19.08.2024"
          },
          {
            "date": "2024-08-20",
            "formatted": "20.08.2024"
          },
          {
            "date": "2024-09-04",
            "formatted": "04.09.2024"
          },
          {
            "date": "2024-09-10",
            "formatted": "10.09.2024"
          },
          {
            "date": "2024-09-12",
            "formatted": "12.09.2024"
          },
          {
            "date": "2024-09-23",
            "formatted": "23.09.2024"
          },
          {
            "date": "2024-09-26",
            "formatted": "26.09.2024"
          },
          {
            "date": "2025-09-24",
            "formatted": "24.09.2025"
          },
          {
            "date": "2025-10-01",
            "formatted": "01.10.2025"
          },
          {
            "date": "2025-10-07",
            "formatted": "07.10.2025"
          },
          {
            "date": "2025-10-08",
            "formatted": "08.10.2025"
          },
          {
            "date": "2025-10-21",
            "formatted": "21.10.2025"
          },
          {
            "date": "2025-10-24",
            "formatted": "24.10.2025"
          },
          {
            "date": "2025-10-29",
            "formatted": "29.10.2025"
          },
          {
            "date": "2025-11-04",
            "formatted": "04.11.2025"
          },
          {
            "date": "2025-11-05",
            "formatted": "05.11.2025"
          },
          {
            "date": "2025-11-11",
            "formatted": "11.11.2025"
          },
          {
            "date": "2025-11-18",
            "formatted": "18.11.2025"
          },
          {
            "date": "2025-11-19",
            "formatted": "19.11.2025"
          },
          {
            "date": "2025-11-26",
            "formatted": "26.11.2025"
          },
          {
            "date": "2026-11-25",
            "formatted": "25.11.2026"
          },
          {
            "date": "2026-11-28",
            "formatted": "28.11.2026"
          },
          {
            "date": "2026-12-02",
            "formatted": "02.12.2026"
          },
          {
            "date": "2026-12-03",
            "formatted": "03.12.2026"
          },
          {
            "date": "2026-12-09",
            "formatted": "09.12.2026"
          },
          {
            "date": "2026-12-12",
            "formatted": "12.12.2026"
          },
          {
            "date": "2026-12-16",
            "formatted": "16.12.2026"
          },
          {
            "date": "2027-12-15",
            "formatted": "15.12.2027"
          },
          {
            "date": "2027-12-30",
            "formatted": "30.12.2027"
          },
          {
            "date": "2028-01-03",
            "formatted": "03.01.2028"
          },
          {
            "date": "2028-01-06",
            "formatted": "06.01.2028"
          },
          {
            "date": "2028-01-08",
            "formatted": "08.01.2028"
          },
          {
            "date": "2028-01-13",
            "formatted": "13.01.2028"
          },
          {
            "date": "2028-01-16",
            "formatted": "16.01.2028"
          },
          {
            "date": "2028-01-20",
            "formatted": "20.01.2028"
          },
          {
            "date": "2028-01-23",
            "formatted": "23.01.2028"
          },
          {
            "date": "2028-01-27",
            "formatted": "27.01.2028"
          },
          {
            "date": "2028-01-28",
            "formatted": "28.01.2028"
          },
          {
            "date": "2028-02-03",
            "formatted": "03.02.2028"
          },
          {
            "date": "2028-02-10",
            "formatted": "10.02.2028"
          },
          {
            "date": "2028-02-11",
            "formatted": "11.02.2028"
          },
          {
            "date": "2028-02-13",
            "formatted": "13.02.2028"
          },
          {
            "date": "2028-02-18",
            "formatted": "18.02.2028"
          },
          {
            "date": "2029-02-17",
            "formatted": "17.02.2029"
          },
          {
            "date": "2029-03-06",
            "formatted": "06.03.2029"
          },
          {
            "date": "2029-03-10",
            "formatted": "10.03.2029"
          },
          {
            "date": "2029-03-11",
            "formatted": "11.03.2029"
          },
          {
            "date": "2029-03-13",
            "formatted": "13.03.2029"
          },
          {
            "date": "2029-03-18",
            "formatted": "18.03.2029"
          },
          {
            "date": "2029-03-20",
            "formatted": "20.03.2029"
          },
          {
            "date": "2029-04-01",
            "formatted": "01.04.2029"
          },
          {
            "date": "2029-04-10",
            "formatted": "10.04.2029"
          },
          {
            "date": "2030-04-08",
            "formatted": "08.04.2030"
          },
          {
            "date": "2030-04-14",
            "formatted": "14.04.2030"
          },
          {
            "date": "2030-04-14",
            "formatted": "14.04.2030"
          },
          {
            "date": "2030-04-18",
            "formatted": "18.04.2030"
          },
          {
            "date": "2030-05-05",
            "formatted": "05.05.2030"
          },
          {
            "date": "2030-05-12",
            "formatted": "12.05.2030"
          },
          {
            "date": "2030-05-20",
            "formatted": "20.05.2030"
          },
          {
            "date": "2030-05-26",
            "formatted": "26.05.2030"
          },
          {
            "date": "2031-05-22",
            "formatted": "22.05.2031"
          },
          {
            "date": "2031-05-28",
            "formatted": "28.05.2031"
          },
          {
            "date": "2031-06-05",
            "formatted": "05.06.2031"
          },
          {
            "date": "2031-06-10",
            "formatted": "10.06.2031"
          },
          {
            "date": "2031-06-16",
            "formatted": "16.06.2031"
          }
        ],
        "unpaid": []
      },
      "stats": {
        "previousCompleted": 0,
        "currentPaidUsed": 77,
        "currentRemaining": 1,
        "currentUnpaid": 0,
        "totalCurrent": 78,
        "totalAllTime": 78
      },
      "lastUpdated": "2025-06-20"
    },
    {
      "id": "claudia-craciun",
      "name": "Claudia Craciun",
      "sessions": {
        "paid": [
          {
            "date": "2024-06-07",
            "formatted": "07.06.2024"
          },
          {
            "date": "2024-06-10",
            "formatted": "10.06.2024"
          },
          {
            "date": "2024-06-17",
            "formatted": "17.06.2024"
          },
          {
            "date": "2024-06-18",
            "formatted": "18.06.2024"
          },
          {
            "date": "2024-06-19",
            "formatted": "19.06.2024"
          },
          {
            "date": "2024-06-20",
            "formatted": "20.06.2024"
          },
          {
            "date": "2024-06-21",
            "formatted": "21.06.2024"
          },
          {
            "date": "2024-06-28",
            "formatted": "28.06.2024"
          },
          {
            "date": "2025-06-26",
            "formatted": "26.06.2025"
          },
          {
            "date": "2025-06-28",
            "formatted": "28.06.2025"
          },
          {
            "date": "2025-07-01",
            "formatted": "01.07.2025"
          },
          {
            "date": "2025-07-04",
            "formatted": "04.07.2025"
          },
          {
            "date": "2025-07-05",
            "formatted": "05.07.2025"
          },
          {
            "date": "2025-07-08",
            "formatted": "08.07.2025"
          },
          {
            "date": "2025-07-11",
            "formatted": "11.07.2025"
          },
          {
            "date": "2025-07-11",
            "formatted": "11.07.2025"
          },
          {
            "date": "2026-07-10",
            "formatted": "10.07.2026"
          },
          {
            "date": "2026-07-22",
            "formatted": "22.07.2026"
          },
          {
            "date": "2026-07-24",
            "formatted": "24.07.2026"
          },
          {
            "date": "2026-07-25",
            "formatted": "25.07.2026"
          },
          {
            "date": "2026-07-29",
            "formatted": "29.07.2026"
          },
          {
            "date": "2026-07-31",
            "formatted": "31.07.2026"
          },
          {
            "date": "2026-08-05",
            "formatted": "05.08.2026"
          },
          {
            "date": "2026-08-23",
            "formatted": "23.08.2026"
          },
          {
            "date": "2026-09-09",
            "formatted": "09.09.2026"
          },
          {
            "date": "2026-09-12",
            "formatted": "12.09.2026"
          },
          {
            "date": "2027-02-21",
            "formatted": "21.02.2027"
          },
          {
            "date": "2027-02-21",
            "formatted": "21.02.2027"
          },
          {
            "date": "2027-02-26",
            "formatted": "26.02.2027"
          },
          {
            "date": "2027-02-28",
            "formatted": "28.02.2027"
          },
          {
            "date": "2027-03-03",
            "formatted": "03.03.2027"
          },
          {
            "date": "2027-03-05",
            "formatted": "05.03.2027"
          },
          {
            "date": "2027-03-07",
            "formatted": "07.03.2027"
          },
          {
            "date": "2027-03-10",
            "formatted": "10.03.2027"
          },
          {
            "date": "2027-03-12",
            "formatted": "12.03.2027"
          },
          {
            "date": "2027-03-14",
            "formatted": "14.03.2027"
          },
          {
            "date": "2027-03-17",
            "formatted": "17.03.2027"
          },
          {
            "date": "2027-03-21",
            "formatted": "21.03.2027"
          },
          {
            "date": "2027-03-24",
            "formatted": "24.03.2027"
          },
          {
            "date": "2027-04-26",
            "formatted": "26.04.2027"
          },
          {
            "date": "2028-03-28",
            "formatted": "28.03.2028"
          },
          {
            "date": "2028-03-28",
            "formatted": "28.03.2028"
          },
          {
            "date": "2028-03-31",
            "formatted": "31.03.2028"
          },
          {
            "date": "2028-04-02",
            "formatted": "02.04.2028"
          },
          {
            "date": "2028-04-04",
            "formatted": "04.04.2028"
          },
          {
            "date": "2028-04-07",
            "formatted": "07.04.2028"
          },
          {
            "date": "2028-04-09",
            "formatted": "09.04.2028"
          },
          {
